N4_35;  Insomma, la valutazione risponde alle domande poste sul consenso informato e sulle pratiche di conservazione del materiale genetico, ma poco dice sugli obiettivi e le finalità complessive della raccolta. Gli Havasupai scelgono la disputa legale. ;0
N4_5;  Vale la pena anche ricordare anche che è solo del 1992 la Convenzione sulla biodiversità, adottata a Rio de Janeiro al famoso Summit della terra ed entrata in vigore l’anno successivo, che include per la prima volta il riconoscimento del ruolo giocato dalle popolazioni indigene nella protezione della biodiversità grazie al loro stile di vita e alle conoscenze tradizionali. ;0
N5_11; «Secondo alcuni teorici, il lavoro è l’ambito primario in cui una persona può mettersi in gioco: è cioè una dimensione che consente di mettersi alla prova, superando delle sfide.  È importante non scadere in una visione distorta del lavoro, incentrata sulla performance e sul carrierismo», ma al tempo stesso la dimensione lavorativa non deve essere demonizzata. ;0
N6_9;  Anita Klinz, la prima art director italiana è il libro scritto da Luca Pitoni, con la collaborazione di Livia Satriano e i contributi di Mario Piazza e Leonardo Sonnoli, per la Fondazione Arnoldo e Alberto Mondadori. ;0
N7_24;  E ancora, cercare di definire obiettivi di allenamento realistici, variare l'orario di allenamento e diversificare il tipo di attività motoria praticata: questo aiuta a rompere la routine che automatizza la pratica sportiva, interrompe il circolo vizioso di cui abbiamo parlato prima. ;0
N9_34;  Ma se l’ipotesi di Watson e Crick era corretta, come poi si è rivelata, la conferma che avevano ragione gliel’ha data proprio la Photograph 51 realizzata da Franklin e vista solo di sfuggita da uno dei due. ;0
F11_5; Così rispose Giovanna Botteri, classe 1957, giornalista e testimone di eventi chiave della storia come la rivoluzione in Romania, la guerra in Bosnia e Kosovo e in Iraq e lo scoppio del Coronavirus in Cina, quando Claudio Sabelli Fioretti, durante un’intervista per L’Adige risalente al 2003, le pose la seguente domanda: “Una donna racconta meglio la guerra?”. ;0.111111111
N23_3; - indicazione degli esami e attività per cui si richiede il riconoscimento, già sostenuti o che si prevede di sostenere entro la data di immatricolazione, cambio corso, trasferimento in ingresso o, nel caso di richiesta di riconoscimenti presso il corso a cui si è già iscritti, entro il 30 settembre 2022;. ;0.111111111
N4_36; E questo è il terreno in cui si inserisce la vicenda della causa avviata dal popolo Havasupai.  Dal 1990 al 1994, i membri della tribù Havasupai avevano donato il proprio Dna ai ricercatori dell’Arizona State University (ASU) per un progetto che studiava il diabete. ;0.111111111
M3_2;  Ed è anche sensibile alle grandi sfide del nostro tempo come quella della responsabilità ambientale, impegnandosi in progetti di valore come quello che lo lega a Sorai dal 2019 e che oggi continua con la presentazione di un terzo modello in edizione limitata, il Big Bang Unico Sorai, di cui parte del ricavato sarà destinato a proteggere i rinoceronti. ;0.142857143
N12_19; Tutti dati che ci fanno capire come il mercato del lavoro sia in un momento che potremmo definire positivo, prendendo questo aggettivo con le pinze, guardando solo gli ultimi 18 anni e senza considerare un’analisi comparativa con altri Paesi europei. ;0.142857143
F6_16; I commenti sono spesso innocui ("è un bravo ragazzo”, “eravamo compagni di scuola") o divertenti (un post ha permesso a tre ragazze di scoprire che erano uscite con lo stesso uomo ne giro di 24 ore). ;0.166666667
N16_2;  Anche oggi, pur non essendo a teatro, ci siamo dentro come personaggi immersi nelle bolle dei social network.  Ognuno di noi è componente di una comunità di persone che spesso pensano pericolosamente in modo troppo simile a noi. ;0.166666667
N18_8;  Se così fosse, allora contrapporre i fatti e i numeri non basterebbe.  Le campagne informative vanno bene, ma servirebbe smontare la presunzione di sapere e soprattutto spiegare i contenuti e il metodo scientifico. ;0.166666667
N25_4;  Quando serve, anche l’auto è disponibile grazie a postazioni di car-sharing.  Moltissime le possibilità per fare sport, per il quale il CUS, Centro Sportivo Universitario, offre un’ampia varietà di discipline, individuali e di squadra. ;0.166666667
N15_11;  Questo numero scende al 78% nei paesi a reddito medio-basso e al 68% nei paesi a basso reddito. Le preoccupazioni per un peggioramento. Il rapporto dell’OMS riporta anche un peggioramento del trend nel periodo 2016 - 2020. ;0.2
N19_5; La conclusione è la necessità di avere un nuovo contratto sociale e un nuovo modo per scriverli: un rapporto pubblico/privato in cui il primo non è asservito e dipendente dagli interessi dei privati, ma in partnership per dare anche delle condizioni mirate sul bene pubblico. ;0.2
N2_21; Come spiega il professor Caracciolo, la presenza di determinati eventi che modificano le abitudini quotidiane in alcuni casi può anche cambiare le cose in meglio, spingendo la persona ad assumere uno stile alimentare meno estremo. ;0.2
N4_37;  Alle persone della popolazione indigena era stato spiegato che la ricerca era finalizzata a capire i determinanti genetici del diabete di tipo II, la cui prevalenza è maggiore tra gli Havasupai adulti che nel resto della popolazione. ;0.2
N4_7;  Inutile dire che sono tanti gli esempi, precedenti ma anche successivi all’entrata in vigore della convenzione, di vero e proprio furto di risorse genetiche tradizionali con minima o nulla condivisione di benefici con le comunità locali. ;0.2
M1_9;  Tanto che oggi, per celebrare il 10° anniversario della nascita del modello, il brand ha tirato fuori dal cassetto il terzo capitolo della saga, lanciando sul mercato un Jazzmaster Face 2 Face III ulteriormente riveduto e corretto. ;0.333333333
M6_9;  Una due ruote che è in continua crescita come uso: secondo l’Osservatorio nazionale della sharing mobility (Osm), infatti, nel 2021 un veicolo condiviso su tre in Italia era proprio un monopattino di tipo green. ;0.333333333
N17_2;  Riprendo, così, un paper uscito la scorsa estate su Plos On, dal titolo “Darwin’s tales”, proprio dedicato all’insegnamento della scienza.  Si tratta di un’analisi di come i contenuti, in particolare sull’evoluzione, sono presentati nei libri dedicati ai bambini. ;0.333333333
F32_9;  Il talento può essere definito come una risorsa di cui ognuno di noi può disporre, è come un tesoro. In un periodo storico nel quale avere “l’asticella delle performance alte” è diventata una richiesta quotidiana, tali risorse acquistano valore quanto più sono utili per la risoluzione dei problemi. ;0.4
M10_25;  A partire da 49€ sul sito. AUDI, PROFUMATORE PER AUTO DESIGN. Si chiama Single Frame il profumatore originale Audi, ricaricabile, dall'aroma orientale con bergamotto, lavanda e legno di sandalo, pensato per elevare l'esperienza di guida. ;0.4
M11_18; Patate. Da non dimenticare: anche le patate sono fonti di carboidrati.  E sono carboidrati semplici, di quelli che ti danno energia subito ma poi ti fanno venire fame.  Perciò, se siete proprio fissati con fisico e linea, meglio mangiarne con moderazione, magari dopo l'allenamento. ;0.4
M2_8;  Ma soprattutto lunghe. LA LANCETTA CHE GIRA IN TRE ORE. Perché negli ultimi 70 anni la subacquea si è evoluta e con essa la strumentazione a sostegno di chi si immerge. ;0.4
M24_20;  Per le persone più allenate, l’intensità dell’esercizio può essere modificata, cambiando le posizioni e gli angoli del corpo in relazione al punto di sospensione e posizionando i piedi su una panca piana o un box di legno. ;0.4
M25_14; Il modo migliore per applicare il profumo. Oltre alle informazioni, di cui sopra, sulle concentrazioni di profumo, ecco quattro consigli utili ad applicare l'acqua di colonia in modo corretto ed efficace. ;0.4
M27_9; 000 e i 25. 000 euro, a seconda della quantità di capelli necessari per ottenere il look desiderato. «I pazienti non sanno necessariamente come funziona.  Potrebbero aver visto alcuni contenuti su TikTok e avere pensato che questo tipo di intervento fosse sicuramente adatto al proprio caso, senza aver riflettuto a fondo. ;0.4
N1_24;  La pandemia ha colpito tutti, ma i più fragili hanno perso fattori protettivi come la comunità e questo li ha portati ancora di più a non comunicare con gli altri: la resilienza è legata sicuramente alle risorse individuali, ma anche il contesto può fare la differenza". ;0.4
N12_2;  Detta con un’analisi più complessa invece, possiamo affermare che non è così semplice come può sembrare.  Il ragionamento però sul mercato del lavoro nel nostro Paese è necessario farlo, anche solo per il fatto che siamo esattamente una “Repubblica fondata sul lavoro”. ;0.4
M16_7; Oltre a conferire un aspetto simile a una moderna scultura rinascimentale, le braccia muscolose offrono anche numerosi benefici sul piano strettamente fisiologico.  «Avere due belle braccia forti porta un enorme vantaggio nell'esecuzione di esercizi come pull-up row, bench press e molti altri. ;0.428571429
N14_4;  “Una donna – risposero i componenti del Collegio, facendo genericamente riferimento alla mancanza di un curriculum completo – per quanto in essa possano concorrere le notizie scientifiche, manca in questa la forza, e fermezza di mano, manca parimente quella necessaria intrepidezza di animo, qualità che si ricercano per bene eseguire le grandi operazioni chirurgiche”. ;0.428571429
N9_8;  Miescher aveva capito come era composta la molecola di DNA: zucchero, acido fosforico e diverse basi che contengono azoto.  Il problema era che per decenni nessuno sapeva a cosa servisse. ;0.428571429
M21_11;  Avete capito bene, non serve nel modo più assoluto come sostituto completo della normale attività fisica o sportiva: pensare di sviluppare doti di forza o resistenza solo con l’elettrostimolatore, o ottenere addominali scolpiti stando comodamente sdraiati sul divano a mangiare patatine fritte, è semplicemente assurdo. ;0.5
M19_14;  Essere redpillati è un termine riferito a qualsiasi risveglio sconvolgente; nel particolare contesto in questione, descrive una concezione della società in cui gli uomini moderni hanno subito uno svantaggio a causa di un cambiamento della posizione di potere delle donne che li ha resi incapaci di trovare partner sessuali. ;0.571428571
M16_9;  «L'ipertrofia è un aumento delle dimensioni dei muscoli, ma può non essere accompagnata da un'autentica forza.  Le braccia grandi non sono sempre braccia forti e le braccia forti non sono sempre braccia grandi». ;0.666666667
M11_3;  Al contrario di quanto si possa credere, le proteine infatti non sono l'unico macronutriente di cui abbiamo bisogno per rafforzare i muscoli: l’organismo ha bisogno anche di grassi sani e, appunto, carboidrati. ;0.8
M3_10;  In edizione limitata a 100 esemplari, l’orologio ha un doppio cinturino in tessuto grigio e velcro, o mimetico nero, viola e arancione, facilmente intercambiabile grazie al sistema brevettato One Click. ;0.8
N29_5;  Il Consiglio d’Europa è un’organizzazione internazionale diversa dall’UE e alla quale aderiscono 46 paesi, alcuni dei quali fanno parte anche dell’UE (come l’Italia), mentre altri invece no (come la Gran Bretagna). ;0.8
M16_10; Zack George, uno dei più importanti atleti di CrossFit al mondo e proprietario di CrossFit BFG, è d'accordo.  «Le braccia forti e muscolose possono comunque essere magre, sono i muscoli in sé ad avere dimensioni maggiori. ;0.833333333
M16_16;  «La forza muscolare è per definizione, la capacità motoria che permette di vincere una resistenza o di opporvisi tramite lo sviluppo di tensione da parte della muscolatura», aggiunge Maritato.  «L'unico modo per aumentare la capacità del muscolo di generare maggiori quantità di forza è quello di sovraccaricarlo continuamente contro una resistenza. ;0.833333333
M9_2;  Il six pack, che non indica per forza salute o capacità atletiche, occupa un posto mitologico nel nostro immaginario collettivo ossessionato dai risultati in palestra.  Diciamoci la verità: tutti abbiamo provato almeno una volta nella vita ad avere un six pack e quasi sempre abbiamo fallito. ;0.833333333
F7_2;  Una volta inseriti, la MTS è in grado di formare e plasmare meccanici e ingegneri di pista che trovano posto, nella stragrande maggioranza dei casi, nei vari team delle due e delle quattro ruote. ;1
M16_33;  Torna in piedi.  Espira.  Impreca quanto basta.  Inverti per il prossimo movimento.  Fanne 10 per lato e cambia braccio. Double Kettlebell Clean & Press. «Il doppio kettlebell clean & press è un esercizio di potenza. ;1
M24_18;  Ci si posiziona sotto il bilanciere sdraiati in posizione supina e afferrato il bilanciere con entrambe le mani, posizionate leggermente più fuori della larghezza delle spalle, si contraggono addominali e glutei mantenere il corpo completamente dritti. ;1
M8_14; Quali sono le opzioni per invertire il processo di perdita dei capelli?. Ci sono diverse possibilità di intervento per invertire il processo di perdita dei capelli: assunzione di farmaci per via orale, pomate, integratori o iniezioni utili a stimolarne la crescita. ;1
M22_3;  L'importante, qualsiasi sia la vostra decisione quando iniziate a perdere i capelli, è di non cadere mai in preoccupazioni: la chierica può essere rallentata da trattamenti ad hoc, come i prodotti anti-caduta, e anche attraverso un'alimentazione corretta. ;1.142857143
M4_6; Motivo in più di soddisfazione per il Ceo di Maserati, Davide Grasso (nella foto), che ha individuato in questa ICE un appuntamento ideale per “coniugare presente e passato, prestazioni sportive e lusso, per un’eccellenza senza tempo, in una vetrina con il pubblico giusto e in linea con i nostri valori”, e in definitiva una versione molto concreta, e apprezzata, di quella che a Modena definiscono la Granturismo way of life nell’anno del grande rilancio di questa gloriosa denominazione, nata proprio in casa Maserati. ;1.142857143
M4_2;  Una cinquantina di auto da sogno, di epoche differenti, radunate a farsi ammirare lungo un weekend, e a sfilare sul tracciato al centro del lago (per Marco Makaus, patron della rassegna, l’ispirazione fu nel 1985 quando un manipolo di stravaganti gentleman driver britannici portò a spasso sul lago le Bentley per celebrare i 100 anni della Cresta Run, la leggendaria, e temeraria, sfida di skeleton – gli slittini da portare a testa in avanti – sulla locale pista). ;1.2
M28_5;  Morale: questo significa che ci sarà sicuramente un'opzione adatta al tuo tipo di pelle, e che potrebbe risolvere il problema delle impurità indesiderate.  Proviamo a individuarla insieme, elencando i migliori detergenti viso per l'uomo. ;1.285714286
M12_9; Piuttosto affidatevi al barbiere e chiedete una personalizzazione. Ok, se vi siete proprio impuntati che volete un buzz cut alla Damiano dei Maneskin o un lob mosso alla Harry Styles, parlatene con il vostro barbiere. ;1.428571429
M29_3;  Che vogliate avere il volto totalmente ripulito da ogni traccia di peluria o invece seguire le tendenze del momento, come la barba “dei tre giorni” o quella a matita, detta chin strap beard: nel primo caso vi suggeriamo di guardare qui, per trovare la lista dei migliori rasoi elettrici del momento; nel secondo, invece, vi consigliamo di proseguire la lettura qui sotto. ;1.428571429
M8_8;  Alcuni di questi causano danni permanenti, mentre su altri è possibile intervenire correggendo il problema.  Stare troppo tempo in ufficio è, secondo la scienza, un fattore di rischio che può portare a diventare calvi. ;1.5
M13_8; I peli lunghi e radi della schiena, la folta peluria sulle spalle: tutto ciò differisce per dimensioni, forma e consistenza dai peli del viso, quindi la potatura di queste aree richiede naturalmente un set di strumenti diversi. ;1.6
M13_14; Il miglior regolabarba per un uso prolungato: Wahl Colour Trim 8 in 1 MultigroomeWahl Colour Trim 8 in 1 Multigroomer, 57,23€. Il miglior accessorio per il corpo: Braun "EasyClick", 32€. ;1.888888889
M12_16;  L'hair cut, del resto, non è meno complesso di un buon colore. Tenete anche conto di come portate la barba e del vostro styling abituale. Per farvi un esempio, non tutti gli uomini con i capelli ricci possono permettersi un taglio alla Joe (Penn Badgley) della serie tv You. ;2
M13_11; Ecco i nostri trimmer (e rasoi elettrici) migliori in circolazione che vi permetteranno di ottenere una peluria completamente personalizzata, dalla parte superiore della schiena sino alle dita dei piedi.  Tra questi troverete sicuramente il miglior regolabarba per uomo, in base alle vostre preferenze di pelo dal collo alle dita dei piedi. ;2
M27_25; Ezekwueche si è sottoposto al trapianto presso Now Hair Time, una clinica popolare e apprezzata dal pubblico dei social media.  La nuova barba gli è costata circa 3. 000 dollari, oltre ai voli. ;2
